740,"Registro de Preços, por um período de 1 ano, podendo ser prorrogado por igual período, desde que comprovado o preço vantajoso, para futura e eventual contratação de empresa especializada no fornecimento e instalação do sistema de piso modular esportivo de polipropileno, destinado tanto a áreas externas outdoor quanto internas indoor, compreendendo elementos como rodapés, rampas de acabamento, cantoneiras, linhas demarcatórias de modalidades futsal, basquete, vôlei, handebol, furos para os mastros de vôlei, mão de obra de instalação, fretes e demais encargos. A prestação dos serviços abrangerá 480.000 quatrocentos e oitenta mil metros quadrados de piso distribuídos em diversas unidades escolares nos municípios do Estado do Paraná, divididos em 10 dez lotes",FUNDEPAR-Instituto Paranaense de Desenvolvimento Educacional,,,,,10.0,10.0,10.0,,-0.06862098682824913,0
755,"contratação de empresas especializadas para a prestação do serviço continuado de manutenção preventiva e corretiva da Rede de Telefonia, do Sistema Hidráulico e de Instalações Civis da infraestrutura existente ou que venha a ser implantada, com fornecimento de materiais e mão de obra sem regime de dedicação exclusiva necessários à completa execução dos serviços para atender as demandas da Secretaria de Estado da Cultura  SEEC.",SEEC-Secretaria de Estado da Cultura (Antigo SECC),,,1.0,2.0,2.0,2.0,,,-0.17616611771289564,0
764,Prestação mensal de serviços de manutenção preventiva e corretiva de elevadores e plataformas elevatórias para atender a demanda da Secretaria da Comunicação.,SECOM-Secretaria de Estado da Comunicação,,,1.0,1.0,3.0,1.0,,,-0.1757484125602699,0
765,"Execução de serviços técnicos especializados de inspeção e cadastro de Obras de Arte Especiais - OAEs, Obras de Arte Correntes - OACs, Estruturas de Contenção de Taludes e Dispositivos de Drenagem Superficial do Sistema Rodoviário Estadual",DER-Departamento de Estradas de Rodagem do Estado do Paraná,,,1.0,2.0,1.0,2.0,,,-0.15765932145592204,0
767,"Contratação de empresa para Prestação de serviços de continuados comuns de manutenção preventiva e corretiva de elevadores, incluindo casa de máquinas, quando aplicável, com o fornecimento de peças, insumos e mão de obra necessários à completa execução dos serviços, de forma a atender a demanda de repartições administrativas da Secretaria de Estado da Fazenda SEFA, pelo período de vinte e quatro meses, conforme quantitativos, requisitos e especificações descritos no Termo de Referência",SEFA-Secretaria de Estado da Fazenda,,,1.0,1.0,1.0,1.0,,,-0.15041211186068898,0
775,"Contratação de empresa especializada com fornecimento dos materiais e mão de obra para instalação de 168,30 metros quadrados de forro em réguas de PVC a ser instalados nos Laboratórios do Departamento de Engenharia Mecânica no bloco O27 no Campus Sede, no endereço Avenida Colombo, nº 5790, Zona 7, no município de Maringá, Paraná",UEM-Universidade Estadual de Maringá,,,1.0,1.0,1.0,1.0,,,-0.1709872017884228,0
782,"Execução dos serviços de manutenção e conservação de vias rurais não pavimentadas da malha rodoviária, das áreas sob jurisdição da Superintendência Regional Norte, subdivido em 2 lotes.",DER-Departamento de Estradas de Rodagem do Estado do Paraná,,,2.0,2.0,2.0,2.0,,,-0.10220049545835191,0
788,"Contratação de empresa especializada em engenharia e/ou arquitetura para execução de serviço de reforma em auditório, banheiro e cantina do Campus de Paranaguá, no município de Paranaguá/PR. Demais informações de acordo com o memorial descritivo e documentos que compõem a pasta técnica do lote.",UNESPAR-Universidade Estadual do Paraná,,,1.0,1.0,1.0,1.0,,,-0.168517713147268,0
789,"Com base na Lei Federal 14.133/2021 e no Decreto Estadual 10.086/2022, torna-se público o
presente edital com o intuito de promover a licitação para a contratação de empresa especializada
para execução de serviços comuns de engenharia, consistindo na execução de pintura nas
edificações do Campus de Paranaguá da Universidade Estadual do Paraná - UNESPAR, conforme
Pasta Técnica e especificações contidas no edital",UNESPAR-Universidade Estadual do Paraná,,,1.0,1.0,1.0,1.0,,,-0.16844961546694853,0
790,"Contratação de empresa especializada para execução de serviço comum de engenharia de reparos na escada de emergência do Edifício sede do DER/PR, sito à Avenida Iguaçu, 420, bairro Rebouças, município de Curitiba, Paraná.",DER-Departamento de Estradas de Rodagem do Estado do Paraná,,,1.0,1.0,1.0,1.0,,,-0.1690857011320419,0
806,"Contratacao de empresa especializada para prestacao do Servico de revitalizacao e 
manutencao do Sistema de Protecao contra Descargas Atmosfericas SPDA dos 
Edifícios Sede e Anexo do TCE-PR.",TCEPR-Tribunal do Contas do Estado do Paraná,,,1.0,2.0,2.0,2.0,,,-0.17256609395993355,0
808,"Registro de Preços, por um período de 1 ano, podendo ser prorrogado por igual período, desde que comprovado o preço vantajoso, para futura e eventual contratação de empresa especializada em serviços de engenharia para execução de sondagens à percussão de solos e ensaios de percolação em diversas unidades escolares nos municípios do Estado do Paraná, divididos em 10 lotes, definidos com base na proximidade dos municípios e nos respectivos Núcleos Regionais de Educação",FUNDEPAR-Instituto Paranaense de Desenvolvimento Educacional,,,62.0,10.0,10.0,10.0,10.0,,-0.01860593267232319,0
810,"A presente licitação tem por objeto a contratação de empresa para prestação de serviço comum de gerenciamento da manutenção, com fornecimento e implantação de sistema informatizado e integrado em ambiente web, que compreenda o controle e gestão compartilhada, bem como a prestação de serviços de manutenção preventiva e corretiva da frota mediante Rede Credenciada, para atender os veículos que compõem a frota da Universidade Estadual do Paraná UNESPAR.",UNESPAR-Universidade Estadual do Paraná,,,1.0,1.0,1.0,1.0,,,-0.16554463219232818,0
813,"Aquisição de equipamentos para os Laboratórios dos Cursos de Engenharia de Produção Agroindustrial e de Turismo da Universidade Estadual do Paraná - UNESPAR, Campus Campo Mourão, por meio do Termo de Convênio 941735/2023.",UNESPAR-Universidade Estadual do Paraná,,,,,30.0,14.0,,,-0.1570207436514096,0
816,Serviços de Manutenção Preventiva e Corretiva em AT Alta Tensão e BT Baixa Tensão no Edifício Sede da PARANAPREVIDÊNCIA Blocos A e B situado na Rua Inácio Lustosa 700 Bairro São Francisco e no Edifício do Servidor situado na Rua Marechal Deodoro 806 Centro ambos localizados na cidade de Curitiba PR.,PRPREV-Serviço Social Autônomo PARANAPREVIDENCIA,,,1.0,1.0,3.0,1.0,,,-0.16563747071003948,0
820,"Serviços comuns de engenharia de reparos no Posto da Policia Rodoviária Estadual de Francisco Beltrão, localizado na PR-180, 478, no município de Francisco Beltrão, Paraná.",DER-Departamento de Estradas de Rodagem do Estado do Paraná,,,,1.0,1.0,1.0,,,-0.1723039291351498,0
829,Contratação de empresa especializada para a prestação de serviços de execução de reparos e manutenções no imóvel que abriga a 12 Ciretran de Londrina.,DETRAN-Departamento de Trânsito do Estado do Paraná,,,1.0,1.0,1.0,1.0,,,-0.16106489656111395,0
832,"Contratação de empresa especializada para execução de serviços comuns de engenharia na Escola Estadual Machado de Assis, localizada na Rua Inglaterra, 1010, Centro, telefone 44 3436-1370, no Município de Itaúna do Sul, Estado do Paraná.",FUNDEPAR-Instituto Paranaense de Desenvolvimento Educacional,,,1.0,1.0,1.0,1.0,,,-0.1667494159298057,0
833,Prestação de serviços continuados de empresa especializada em  manutenção preventiva e corretiva  para elevadores e plataformas de passageiros da Universidade Estadual de Ponta Grossa,UEPG-Universidade Estadual de Ponta Grossa,,,1.0,1.0,1.0,1.0,,,-0.17013312274306186,0
843,"Selecionar a proposta apta a gerar o resultado mais vantajoso para contratação de serviço especializado para MANUTENÇÕES PREVENTIVAS E CORRETIVAS NO GRUPO GERADOR do complexo hospitalar, campus universitário e fazenda escola da UEPG.",UEPG-HURCG-Hospital Universitário Regional dos Campos Gerais,,,1.0,3.0,3.0,3.0,,,-0.1713892697457396,0
847,"Registro de preços com prazo de vigência de um ano prorrogável por igual período desde que comprovada a vantajosidade para futura e eventual contratação de SERVIÇOS DE LIMPEZA ASSEIO CONSERVAÇÃO E OUTROS, com seus respectivos insumos tais como Uniformes - EPIs Insumos - Materiais e Equipamentos - Ferramentas, por meio da metodologia de contratação por postos trabalho com dedicação exclusiva de mão de obra e pela metodologia de contratação por metros quadrados",DECON-Departamento de Logística para Contratações Públicas (Antigo DEAM),181.0,,203.0,7.0,359.0,7.0,1112.0,,0.133827186507817,1
847,"Registro de preços com prazo de vigência de um ano prorrogável por igual período desde que comprovada a vantajosidade para futura e eventual contratação de SERVIÇOS DE LIMPEZA ASSEIO CONSERVAÇÃO E OUTROS, com seus respectivos insumos tais como Uniformes - EPIs Insumos - Materiais e Equipamentos - Ferramentas, por meio da metodologia de contratação por postos trabalho com dedicação exclusiva de mão de obra e pela metodologia de contratação por metros quadrados",DECON-Departamento de Logística para Contratações Públicas (Antigo DEAM),181.0,,203.0,7.0,359.0,7.0,1112.0,,0.133827186507817,1
852,"Contratacao de empresa para prestacao de servicos tecnicos especializados de 
reestruturacao e modernizacao de portais institucionais, desenvolvimento de aplicativo 
movel, evolucao, manutencao e suporte de portais institucionais e de aplicativo movel, 
sem dedicacao exclusiva de mao de obra, com fornecimento de licenciamento, 
implantacao, evolucao, manutencao e suporte de Plataforma de Experiencia Digital 
DXP, durante o periodo de 36 trinta e seis meses, podendo ser prorrogado por ate 10 
dez anos, na forma dos artigos 106 e 107 da Lei n 14.133, de 2021.",TCEPR-Tribunal do Contas do Estado do Paraná,,,5.0,6.0,6.0,6.0,,,-0.14502969620865275,0
857,Aquisicao de materiais eletricos para atender as demandas da UENP.,UENP-Universidade Estadual do Norte do Paraná,,,4.0,7.0,56.0,7.0,,,-0.14096920099439575,0
863,Contratação de uma empresa especializada em serviços de engenharia para execução do projeto de reforma e readequação da cobertura do Centro Previdenciário de Curitiba incluindo sistema de coleta de águas pluviais cobertura e rede,PRPREV-Serviço Social Autônomo PARANAPREVIDENCIA,,,,,1.0,1.0,,,-0.17276990146206722,0
874,"CONTRATAÇÃO DE EMPRESA PARA PRESTAÇÃO DE SERVIÇOS COMUNS DE ENGENHARIA DE CONSTRUÇÃO DE MURO PALITO NO CÂMPUS CEDETEG DA UNICENTRO,
COM RECURSOS DO TED 64/24 SETI.",UNICENTRO-Universidade Estadual do Centro-Oeste,,,1.0,1.0,1.0,1.0,,,-0.16726355822692496,0
880,Contratacao de empresa para reforma em moradia estudantil.,UNESPAR-Universidade Estadual do Paraná,,,1.0,1.0,1.0,1.0,,,-0.17281944606964605,0
898,Contratação de empresa para reforma de 178 cadeiras de anfiteatro,UEM-Universidade Estadual de Maringá,,,1.0,1.0,1.0,1.0,,,-0.17700865294988039,0
900,"Contratação de empresa especializada para a prestação de serviços de execução de reparos e manutenções no imóvel que abriga a 67 Ciretran, Município de Santo Antônio do Sudoeste-PR,",DETRAN-Departamento de Trânsito do Estado do Paraná,,,1.0,1.0,1.0,1.0,,,-0.1658034094527867,0
920,"Contratação de empresa especializada para prestação de serviços terceirizados de manutenção, limpeza e desinfecção dos reservatórios de água e desinsetização, desratização e manejo de fauna silvestre para a UEPG e seu Complexo Hospitalar.",UEPG-HURCG-Hospital Universitário Regional dos Campos Gerais,,,1.0,3.0,24.0,3.0,,,-0.1635689873688559,0
939,Registro de Preço de aquisição de Eletrodo para cautério e caneta para bisturi elétrico para atender a demanda do Unidade de Internamento do HUOP.,UNIOESTE REITOR-Universidade Estadual do Oeste do Paraná - Reitoria,,,,20.0,11.0,11.0,11.0,,-0.14313755602558415,0
946,Contratação de Empresa de Engenharia ou Arquitetura Especializada para Execução de Serviços Comuns de Manutenções e Reformas de Acessibilidade no Bloco Didático e em Áreas do Pátio no Campus de Paranavaí da UNESPAR EG 01.2024,UNESPAR-Universidade Estadual do Paraná,,,1.0,1.0,1.0,1.0,,,-0.16657605254715152,0
947,Contratação de Empresa Especializada para Execução de Serviços Comuns de Engenharia para Reforma e Adequação de Edificação Existente Sem Uso para Abrigar o Espaço Integrado da Saúde do Campus de Paranavaí da UNESPAR EG 01/2024.,UNESPAR-Universidade Estadual do Paraná,,,1.0,1.0,1.0,1.0,,,-0.17333860428545972,0
949,"CONTRATAÇÃO DE EMPRESA ESPECIALIZADA E QUALIFICADA
PARA A PRESTAÇÃO DE SERVIÇOS DE MANUTENÇÃO PREVENTIVA E CORRETIVA DE
EQUIPAMENTOS DE IMAGENS MÉDICAS",FUNEAS-Fundação Estatal de Atenção em Saúde do Estado do Paraná,,,4.0,11.0,7.0,11.0,,,-0.13528278376088138,0
954,"Contratação de empresa para prestação de serviços comuns de engenharia para adequação de contenção de talude no Câmpus Irati da Unicentro, com recursos do TED 64/24 SETI.",UNICENTRO-Universidade Estadual do Centro-Oeste,,,,,1.0,1.0,,,-0.17036005211943167,0
956,Contratação de empresa especializada na prestação de serviços de manutenção e reparo em portas de vidro do CCTG/Centro Cultural Teatro Guaíra.,CCTG-Centro Cultural Teatro Guaira,,,,,1.0,1.0,,,-0.17098346350919857,0
967,Aquisição de materiais elétricos e eletrônicos,UEM-Universidade Estadual de Maringá,,,,8.0,8.0,8.0,,,-0.15820249932705505,0
968,Aquisição de equipamentos hidráulicos e elétricos instalados,UEM-Universidade Estadual de Maringá,,,,,2.0,1.0,,,-0.1729860422278916,0
979,Prestação de serviços continuados de manutenção e instalação de aparelhos condicionadores de ar.,UNIOESTE TOLEDO-Universidade Estadual do Oeste do Paraná - Campus Toledo,,,1.0,2.0,9.0,2.0,,,-0.17677375862596245,0
982,Contratação de empresa especializada para a prestação de serviços de execução de reparos e manutenções no imóvel que abriga a 85ª Ciretran de Quedas do Iguaçu.,DETRAN-Departamento de Trânsito do Estado do Paraná,,,1.0,1.0,1.0,1.0,,,-0.14281979470887762,0
990,Contratação de empresa especializada para prestação de serviço de limpeza dos vidros dos pavimentos internos e da armação interna da cobertura - telhado - do saguão do Hospital Universitário Regional dos Campos Gerais,UEPG-HURCG-Hospital Universitário Regional dos Campos Gerais,,,1.0,1.0,1.0,1.0,,,-0.1766074467242073,0
992,"Contratação de empresa especializada em prestação de serviços continuados de roçada para corte e rastelo por metro quadrado, com fornecimento de mão de obra para Campus sede e extensões da Universidade Estadual de Maringá.",UEM-Universidade Estadual de Maringá,,,2.0,9.0,9.0,9.0,,,-0.1441788242907469,0
1002,"SERVIÇOS DE SANEAMENTO, LIMPEZA E ESGOTAMENTO DE FOSSAS E
HIDROJATEAMENTO",FUNEAS-Fundação Estatal de Atenção em Saúde do Estado do Paraná,,,1.0,2.0,1.0,2.0,,,-0.1482083730974933,0
1029,Aquisição de materiais para manutenção de bens imóveis,UEM-Universidade Estadual de Maringá,,,,15.0,14.0,17.0,,,-0.15299451732617625,0
1042,Contratação de empresa especializada para fornecimento de peças para manutenção de aparelhos de radiologia,UEM-Universidade Estadual de Maringá,,,,1.0,1.0,1.0,,,-0.16658169983329668,0
1043,Contratação de empresa para manutenção corretiva do Pivô Central de Irrigação do CTI - Centro de Treinamento de Irrigação.,UEM-Universidade Estadual de Maringá,,,1.0,1.0,1.0,1.0,,,-0.17655575532008078,0
1048,"Obra de reforma eletrica na UNESPAR, campus de Campo Mourao.",UNESPAR-Universidade Estadual do Paraná,,,1.0,1.0,1.0,1.0,,,-0.15376076700096303,0
1050,Aquisição de Equipamentos para Atividades do Curso de Especialização em Projetos e Obras Públicas.,UEPG-Universidade Estadual de Ponta Grossa,,,3.0,4.0,4.0,5.0,,,-0.16225255006136452,0
1066,"Manutenção aeronáutica preventiva e corretiva, com fornecimento de peças e demais itens necessários a manter a aeronavegabilidade para o helicóptero Robinson R44, Raven II, ano 2004, matrícula PP ADN, de acordo com o manual de manutenção da
aeronave, para uma programação de 600 horas e/ou 24 meses, para atender a demanda do Batalhão de Policia militar de Operações Aéreas, conforme termo de referencia.",PMPR-BPMOA-Batalhão de Polícia Militar de Operações Aéreas - SESP,,,,,1.0,1.0,,,-0.17187394386078175,0
1068,Com base na Lei Federal 14.133/2021 e no Decreto Estadual 10.086/2022 torna-se público o presente edital com o intuito de promover a licitação para a contratação de empresa especializada na execução da obra de reforma do passeio público -calçada externa- que dá acesso ao Teatro Laboratório -TELAB -e pintura predial e muros da Sede Artes da Cena -SEARC- do Campus Curitiba II da Universidade Estadual do Paraná - UNESPAR - conforme planilha orçamentária de referência constante no Anexo XIII e Pasta técnica.,UNESPAR-Universidade Estadual do Paraná,,,1.0,2.0,2.0,2.0,,,-0.1703786374591627,0
1079,"Contratação de empresa especializada para execução, sob demanda, engenharia em obras de manutenções prediais preventivas e/ou corretivas, com fornecimento incluso de materiais e mão de obra sem dedicação exclusiva, conforme condições e exigências estabelecidas neste instrumento e nos seus anexos.",ALEP-Assembleia Legislativa do Estado do Paraná,,,,,,,,,-0.17796841484479664,0
1080,"CONTRATAÇÃO DE EMPRESA PARA PRESTAÇÃO DE SERVIÇOS COMUNS DE ENGENHARIA PARA REFORMA NAS INSTALAÇÕES ELÉTRICAS DO PRÉDIO PRINCIPAL DO
CÂMPUS IRATI DA UNICENTRO, COM RECURSOS DO TED 64/24 SETI.",UNICENTRO-Universidade Estadual do Centro-Oeste,,,1.0,1.0,1.0,1.0,,,-0.15581978095473764,0
1090,"Fornecimento e instalação de piso modular esportivo de polipropileno, através do sistema de registro de preços, tanto para áreas externas outdoor quanto internas indoor e compreende elementos como rampas de acabamento, cantoneiras, linhas demarcatórias de modalidades futsal, basquete, vôlei, handebol, furos para os mastros de vôlei, mão de obra de instalação, fretes e demais encargos. A prestação dos serviços abrangerá a instalação de piso em quadras já existentes, distribuídas em diversas unidades escolares nos municípios do Estado do Paraná. Conforme especificado no Termo de Referência.",FUNDEPAR-Instituto Paranaense de Desenvolvimento Educacional,,,,,10.0,10.0,10.0,,-0.059905223616908365,0
1095,"Contratação de empresa especializada para prestação de serviço continuado, sem disponibilização de mão-de-obra exclusiva, com fornecimento de insumos e equipamentos, para limpeza, tratamento, conservação e manutenção da piscina semiolímpica da Unioeste/Campus de Marechal Cândido Rondon-PR.",UNIOESTE MCROND-Universidade Estadual do Oeste do Paraná - Campus Marechal Cândido Rondon,,,1.0,1.0,1.0,1.0,,,-0.1718867277832506,0
1108,"Contrataçao de empresa especializada em engenharia e/ou arquitetura para execuçao de serviço comum de Engenharia, sendo este de reforma e adaptaçao em ambientes da sede Barao do Campus de Curitiba I-Embap da Unespar.",UNESPAR-Universidade Estadual do Paraná,,,1.0,1.0,1.0,1.0,,,-0.16001170052830416,0
1132,"Obras de reforma de acessibilidade, UNESPAR - Campo Mourao.",UNESPAR-Universidade Estadual do Paraná,,,1.0,1.0,1.0,1.0,,,-0.16514093897520193,0
1152,"Contratação de empresa de engenharia para instalação de transformador e adequações na rede elétrica do Campus de Cornélio Procópio, com fornecimento de materiais.",UENP-Universidade Estadual do Norte do Paraná,,,1.0,1.0,1.0,1.0,,,-0.17750320833614064,0
1159,Registro de Preço para futura e eventual aquisição de acessórios para manutenção de equipamentos médico hospitalares para uso no Hospital Universitário do Oeste do Paraná - HUOP.,UNIOESTE REITOR-Universidade Estadual do Oeste do Paraná - Reitoria,,,,47.0,19.0,20.0,19.0,,-0.10282201416115444,0
1177,Contratação de empresa especializada para execução de manutenção em telhados do Parque Universitário.,UENP-Universidade Estadual do Norte do Paraná,,,1.0,1.0,1.0,1.0,,,-0.1671839198790125,0
1178,"EMPRESA ESPECIALIZADA NA
PRESTAÇÃO DE SERVIÇO DE LOCAÇÃO DE EQUIPAMENTO DE GASOMETRIA COM MANUTENÇÃO
PREVENTIVA E CORRETIVA, FORNECIMENTO DE PEÇAS E INSUMOS PARA REALIZAÇÃO DE
EXAMES",FUNEAS-Fundação Estatal de Atenção em Saúde do Estado do Paraná,,,3.0,2.0,1.0,2.0,,,-0.15464303912163269,0
1194,Fornecimento de peças e acessórios para manutenção para uso da marcenaria.,UEL-Universidade Estadual de Londrina,,,,,21.0,21.0,,,-0.1471614499902803,0
1198,"A presente licitação tem por objeto a aquisição de materiais e equipamentos utilizados com frequência na manutenção das Unidades a fim de possibilitar a conservação de estruturas dos Parques Estaduais, em especial daquelas abertas à visitação",IAT-Instituto Água e Terra (Antigo IAP),,,14.0,26.0,34.0,34.0,,,-0.03992512053472208,0
1209,Prestação de serviços de limpeza e manutenção de placas fotovoltaicas.,JUCEPAR-Junta Comercial do Paraná,,,,,2.0,1.0,,,-0.16840712049577317,0
1223,"Contratação de empresa especializada para a prestação de serviços comuns de manutenção preventiva e corretiva de grupos geradores de energia elétrica, incluindo troca de peças quando necessário, para atender a demanda do Departamento da Polícia Civil/DPC na região de Curitiba Divisão de Homicídios e Proteção à Pessoa-DHPP, Região Metropolitana-Almirante Tamandaré, Araucária, Fazenda Rio Grande, Pinhais, São José dos Pinhais, Litoral Matinhos e Paranaguá, Interior região norte do Estado Ivaiporã e Londrina e Interior região oeste do Estado Cascavel e Guaíra",SESP-Secretaria de Estado da Segurança Pública,,,,7.0,16.0,7.0,,,-0.1630537862232373,0
1240,"Prestação de serviços contínuos especializados em GESTÃO DE EQUIPAMENTOS E MANUTENÇÃO PREVENTIVA, CORRETIVA, QUALIFICAÇÃO E CALIBRAÇÃO DE EQUIPAMENTOS E INSTRUMENTO DE MEDIÇÃO, com fornecimento de peças, para atender a demanda das Unidades do Laboratório Central do Estado  Lacen PR e Laboratórios Regionais  Larens.",SESA-FUNSAUDE-Fundo Estadual de Saúde do Paraná - FUNSAUDE,,,,,36.0,12.0,,,-0.15126391184628202,0
1242,"Obra de instalacao de SPDA, para a UNESPAR,campus de Campo Mourao",UNESPAR-Universidade Estadual do Paraná,,,1.0,1.0,1.0,1.0,,,-0.16504632213745685,0
1246,"Aquisição de equipamento para áudio, vídeo e foto e material elétrico, eletrônico e de processamento de dados",UEM-Universidade Estadual de Maringá,,,,8.0,10.0,10.0,,,-0.16203727438134607,0
1252,"Contratação de empresa para a prestação de Serviços de Engenharia de Reparos na Fábrica de Placas da Superintendência Regional Leste e no Laboratório Central do DER/PR, localizada na Rua José Veríssimo, 333, CEP 82820-000, com área aproximada de 2.933,00 m2.",DER-Departamento de Estradas de Rodagem do Estado do Paraná,,,1.0,1.0,1.0,1.0,,,-0.13834139124794126,0
1272,"Ata de Registro de Preços com a finalidade de contratação de serviço comum de engenharia
para fabricação e transporte de abrigos para pontos de ônibus.",AMEP-Agência de Assuntos Metropolitanos do Paraná (Antigo COMEC),,,3.0,4.0,3.0,3.0,3.0,,-0.1436595351944021,0
1310,Contratação de empresa especializada para execução de manutenções na sede da Reitoria da UENP.,UENP-Universidade Estadual do Norte do Paraná,,,1.0,1.0,1.0,1.0,,,-0.17370102928712933,0
1312,"Contratação de empresa para a prestação de serviços comuns de engenharia, referentes a reparos no piso da Garagem do Edifício Sede do DEPARTAMENTO DE ESTRADAS DE RODAGEM DO PARANÁ - DER PR, com área aproximada de 2.745,00 m2, sito à Avenida Iguaçu, 340, no município de Curitiba, Paraná.",DER-Departamento de Estradas de Rodagem do Estado do Paraná,,,2.0,1.0,1.0,1.0,,,-0.15989259933865752,0
1331,"Aquisição de materiais, brindes e equipamentos para operacionalização
da Operação Verão 2024/2025, do Departamento da Polícia Civil.",SESP-Secretaria de Estado da Segurança Pública,,,7.0,12.0,12.0,12.0,,,-0.11236671293821243,0
1338,"Locação de equipamentos gráficos, composto por 02 Impressoras Laser ou Led Monocromática, 01 Impressora Laser ou Led Colorida, 01 Equipamento de Recorte para Papel, 01 Impressora
Multifuncional de Grandes Formatos A0, 02  Scanner de Produção para Digitalização em Cor e PeB, 01 Licença de Software para Processamento de Formulários, incluindo fornecimento dos
equipamentos e softwares, entrega, instalação, treinamentos operacionais, garantia e fornecimento de assistência técnica no local da instalação, suporte aos usuários, manutenção preventiva e corretiva, reposição de peças e todos os suprimentos/consumíveis necessários, originais da mesma marca dos equipamentos, inclusive papel e grampos, mediante contrato de manutenção.",UNIOESTE REITOR-Universidade Estadual do Oeste do Paraná - Reitoria,,,1.0,1.0,7.0,1.0,,,-0.1683174807129349,0
1341,CONTRATAÇÃO DE EMPRESA PARA MANUTENÇÃO DO SISTEMA DE FILTRAGEM POR OSMOSE DA CME/HUM,UEM-Universidade Estadual de Maringá,,,,,2.0,1.0,,,-0.17374853339190416,0
