84,"Seleção de empresa do ramo da construção civil visando formalização de parceria no âmbito do Programa Minha Casa, Minha Vida recursos do FGTS - Fundo de Garantia de Tempo de Serviço, doravante denominado MCMV - FGTS, e do Programa Casa Fácil PR, doravante denominado CFPR, através da permissão de uso de terreno de propriedade da COHAPAR, no Município de RIO BOM, com a finalidade de desenvolver e produzir empreendimento habitacional na linha de atendimento de provisão financiada de unidades habitacionais novas, totalizando 23 unidades habitacionais de forma a ampliar o acesso à moradia.",COHAPAR-Companhia de Habitação do Paraná,,,1.0,39.0,30.0,30.0,28.0,,-0.09220918671416767,0
90,Registro de preços para futura e eventual AQUISIÇÃO DE MATERIAL ELÉTRICO DE ILUMINAÇÃO.,COHAPAR-Companhia de Habitação do Paraná,,,,3.0,3.0,3.0,3.0,,-0.1728315271967127,0
95,"Contratação de empresa do ramo da construção civil, especializada em obras e serviços de engenharia para conclusão de 47 UH e execução de infraestrutura em área localizada no município de FIGUEIRA/PR, proporcionando padrões mínimos de habitabilidade, salubridade, segurança e desempenho, definidos pelas posturas municipais, normas técnicas brasileiras e conforme especificações constantes dos documentos e informações constantes do Termo de Referência - ANEXO I, e do Volume Técnico - Projeto Executivo de Arquitetura e Engenharia - ANEXO I-E.",COHAPAR-Companhia de Habitação do Paraná,,,2.0,2.0,41.0,4.0,,,-0.15083874816034243,0
96,Aquisição de Materiais Elétricos e de Rede Lógica.,CELEPAR-Companhia de Tecnologia da Informação e Comunicação do Paraná,,,4.0,9.0,81.0,8.0,,,-0.10906188594969668,0
97,"2ª PUBLICAÇÃO - Contratação de empresa do ramo da construção civil, especializada em obras e serviços de em engenharia, que será responsável pela produção do empreendimento habitacional PATO BRANCO .13ª ETAPA, MUNICÍPIO DE PATO BRANCO/PR, destinado às pessoas da TERCEIRA IDADE, compreendendo a elaboração e desenvolvimento de projetos Básico e Executivo em metodologia BIM, a execução de obras e serviços de engenharia, a montagem, a realização de testes e as demais operações necessárias e suficientes para a entrega final de habitação, ... que resultem em 40 unidades habitacionais e equipamentos comunitários dotados de padrões mínimos de habitabilidade, salubridade, segurança e desempenho, definidos pelas posturas municipais, normas técnicas brasileiras e conforme especificações constantes dos documentos e informações do Termo de Referência - ANEXO I, e do Anteprojeto de Arquitetura e Engenharia - Volume Técnico - ANEXO I-H.",COHAPAR-Companhia de Habitação do Paraná,,,2.0,2.0,12.0,9.0,46.0,,-0.14959990353859653,0
102,"Contratação de pessoa jurídica para fornecimento de solução de ERP Enterprise Resource Planning, na modalidade SaaS Software como Serviço, bem como os requisitos mínimos necessários de boas práticas para a implantação, suporte, atualização e manutenção legal e tecnológica evolutiva da solução, nos termos do edital e seus anexos.",CELEPAR-Companhia de Tecnologia da Informação e Comunicação do Paraná,,32.0,2.0,2.0,30.0,39.0,114.0,,-0.09058160638618762,0
103,"Registro de Preços para futura e eventual contratação de pessoa jurídica para fornecimento de Câmeras IP para reconhecimento Facial, Câmeras IP WI-FI, Switches e Desktops, incluindo manutenção, suporte técnico e demais condições estabelecidas no Termo de Referência.",CELEPAR-Companhia de Tecnologia da Informação e Comunicação do Paraná,,2.0,8.0,23.0,60.0,23.0,59.0,,-0.05885262972153171,0
103,"Registro de Preços para futura e eventual contratação de pessoa jurídica para fornecimento de Câmeras IP para reconhecimento Facial, Câmeras IP WI-FI, Switches e Desktops, incluindo manutenção, suporte técnico e demais condições estabelecidas no Termo de Referência.",CELEPAR-Companhia de Tecnologia da Informação e Comunicação do Paraná,,2.0,8.0,23.0,60.0,23.0,59.0,,-0.05885262972153171,0
103,"Registro de Preços para futura e eventual contratação de pessoa jurídica para fornecimento de Câmeras IP para reconhecimento Facial, Câmeras IP WI-FI, Switches e Desktops, incluindo manutenção, suporte técnico e demais condições estabelecidas no Termo de Referência.",CELEPAR-Companhia de Tecnologia da Informação e Comunicação do Paraná,,2.0,8.0,23.0,60.0,23.0,59.0,,-0.05885262972153171,0
104,"Seleção de empresa do ramo da construção civil visando formalização de parceria no âmbito do Programa Minha Casa, Minha Vida recursos do FGTS - Fundo de Garantia de Tempo de Serviço, doravante denominado MCMV - FGTS, e do Programa Casa Fácil PR, doravante denominado CFPR, através da permissão de uso de terreno de propriedade do MUNICÍPIO, no Município de ARAPUÃ, com a finalidade de desenvolver e produzir empreendimento habitacional na linha de atendimento de provisão financiada de unidades habitacionais novas, totalizando 19 unidades habitacionais de forma a ampliar o acesso à moradia.",COHAPAR-Companhia de Habitação do Paraná,,,3.0,4.0,5.0,4.0,,,-0.16969920220753776,0
105,"Seleção de empresa do ramo da construção civil visando formalização de parceria no âmbito do Programa Minha Casa, Minha Vida recursos do FGTS - Fundo de Garantia de Tempo de Serviço, doravante denominado MCMV - FGTS, e do Programa Casa Fácil PR, doravante denominado CFPR, através da permissão de uso de terreno de propriedade do MUNICÍPIO, no Município de PORTO RICO, com a finalidade de desenvolver e produzir empreendimento habitacional na linha de atendimento de provisão financiada de unidades habitacionais novas, totalizando 96 unidades habitacionais de forma a ampliar o acesso à moradia.",COHAPAR-Companhia de Habitação do Paraná,,,2.0,38.0,22.0,22.0,20.0,,-0.085240792669879,0
107,"Registro de Preços para futura e eventual contratação de empresa especializada na prestação de serviços de infraestrutura, cabeamento lógico, instalação de equipamentos e instalações elétricas, por demanda, incluindo instalação, remoção, ampliação, remanejamento, manutenção preventiva e corretiva, testes de funcionalidade, com o fornecimento e substituição de materiais e outros serviços correlatos, conforme as condições constantes no presente edital e seus anexos.",CELEPAR-Companhia de Tecnologia da Informação e Comunicação do Paraná,12.0,47.0,2.0,8.0,92.0,59.0,337.0,,0.05343006651721782,1
108,"Contratação de pessoa jurídica para prestação de serviços técnicos de manutenção preventiva e corretiva nos sistemas de recalque de água da Celepar, por um período de 24 vinte e quatro meses, compreendendo reparos, assistência mecânica e elétrica, com fornecimento de pecas e acessórios, em equipamentos instalados no prédio da Celepar localizado na Rua Mateus Leme, 1561 - Curitiba PR.",CELEPAR-Companhia de Tecnologia da Informação e Comunicação do Paraná,,,3.0,4.0,12.0,4.0,,,-0.1689300461086256,0
110,"Contratação de solução, prevendo o fornecimento e instalação de equipamentos para a solução, prestação de serviços de manutenção e suporte técnico com o fornecimento de peças, configuração de sistemas de Áudio, Vídeo, Automação, Interatividade e Sistema de Alimentação Ininterrupta e treinamento na operação das salas de reuniões com sistema de web conferência para a Celepar.",CELEPAR-Companhia de Tecnologia da Informação e Comunicação do Paraná,,,1.0,1.0,111.0,2.0,,,-0.07116595234072892,0
111,"Seleção de empresa do ramo da construção civil visando formalização de parceria no âmbito do Programa Minha Casa, Minha Vida recursos do FGTS - Fundo de Garantia de Tempo de Serviço, doravante denominado MCMV - FGTS, e do Programa Casa Fácil PR, doravante denominado CFPR, através da permissão de uso de terreno de propriedade do MUNICÍPIO, no Município de BARBOSA FERRAZ, com a finalidade de desenvolver e produzir empreendimento habitacional na linha de atendimento de provisão financiada de unidades habitacionais novas, totalizando 20 unidades habitacionais de forma a ampliar o acesso à moradia.",COHAPAR-Companhia de Habitação do Paraná,,,4.0,6.0,10.0,6.0,,,-0.16094154772420627,0
112,"Registro de Preços para futura e eventual contratação de empresa de gerenciamento de canal eletrônico, instalação e manutenção de equipamentos para transmissão diária de informação, criação de conteúdo e gerenciamento de fila, conforme condições e exigências estabelecidas no Edital e seus anexos.",CELEPAR-Companhia de Tecnologia da Informação e Comunicação do Paraná,17.0,,5.0,4.0,36.0,31.0,517.0,,-0.0823419581240794,0
115,"Contratação de empresa do ramo da construção civil, especializada em obras e serviços de engenharia para conclusão de obras de pavimentação e sinalização viária, em área localizada no Conjunto Habitacional Primavera - 11ª. Etapa, no município de CRUZEIRO DO OESTE-PR, proporcionando padrões mínimos de salubridade, segurança e desempenho, definidos pelas posturas municipais, normas técnicas brasileiras e conforme especificações constantes dos documentos e informações constantes do Termo de Referência - ANEXO I, e do Volume Técnico - Projeto Executivo de Engenharia - ANEXO I-E.",COHAPAR-Companhia de Habitação do Paraná,,,2.0,2.0,5.0,4.0,,,-0.16965753875318107,0
2,"Contratação de empresa especializada para prestação de serviços de engenharia para a execução do remanescente de obra e conclusão da Delegacia Cidadã Padrão II da cidade de Colombo, Paraná.",SECID-Secretaria de Estado das Cidades (Antigo SEDU),,,5.0,50.0,75.0,66.0,94.0,,0.008687861564774857,1
4,"Contratação de empresa para prestar serviços de manutenção viária nas áreas sob responsabilidade dos Portos do Paraná, com pavimento rígido de concreto e com bloco intertravado, incluindo fornecimento de materiais, mão de obra e equipamentos, pelo período de 24 vinte e quatro meses, possibilitada a prorrogação do contrato desde que atendidos os dispositivos pertinentes da Lei Federal 13.303/2016 e haja concordância de ambas as partes, conforme justificativas, normas e demais especificações  estabelecidas no Termo de referência, Edital e anexos.",APPA-Administração dos Portos de Paranaguá e Antonina,,,2.0,5.0,17.0,17.0,40.0,,-0.05119906652465961,0
5,"Contratação de empresa especializada em climatização, para fornecimento e instalação de  equipamentos e complementos de sistema de ar-condicionado, conforme projeto e memorial descritivo, em todos os pavimentos do bloco A da PARANAPREVIDÊNCIA.",PRPREV-Serviço Social Autônomo PARANAPREVIDENCIA,,,7.0,10.0,21.0,16.0,1.0,,0.11334196397329077,1
8,"Contratação de empresa especializada para prestação de serviço continuado, sem mão de obra exclusiva, para fornecimento de solução de impressão colorida composta de 2 unidades de Impressora Colorida SRA3 de igual descrição e configuração, pelo prazo de 62 meses, incluídos a disponibilização de equipamentos novos, de primeiro uso e em linha de produção, manutenção preventiva e corretiva, assistência e suporte técnico, com cobertura total de peças, insumos, consumíveis e componentes, respeitadas as especificações técnicas e quantidades descritas neste edital e seus anexos.",CELEPAR-Companhia de Tecnologia da Informação e Comunicação do Paraná,3.0,,7.0,7.0,15.0,12.0,5.0,,-0.14130857001144648,0
12,Locação de escavadeira hidráulica para realização de serviço de manutenção na via permanente e no terminal da Ferroeste de acordo com especificações presentes no Termo de Referência.,FERROESTE-Estrada de Ferro Paraná Oeste S.A.,,,2.0,135.0,77.0,84.0,48.0,,0.0616607605139724,1
16,"Pregão Eletrônico, do Tipo Menor preço por lote, objetivando o Registro de Preços para Futura e eventual contratação de empresa para prestação de serviço SERVENTE, COPEIRO, COZINHEIRO, AUXILIAR DE COZINHA, ENCARREGADA, PORTEIRO E OFICIAL DE MANUTENÇÃO, COLETOR DE RESÍDUOS COM FORNECIMENTO DE MÃO DE OBRA, UNIFORMES, E EQUIPAMENTOS DE PROTEÇÃO INDIVIDUAL para o Hospital Universitário do Oeste do Paraná - HUOP.",UNIOESTE HUOP-Universidade Estadual do Oeste do Paraná - Hospital Universitário do Oeste do Paraná,,,1.0,57.0,31.0,36.0,18.0,,-0.08971092987932183,0
27,"Contratação de empresa especializada em consultoria e auditoria contábil, fiscal, tributária, trabalhista e previdenciária para prestação de serviços de apoio a fiscalização para conferência qualitativa e quantitativa de documentação exigida em contratos de cessão de mão de obra, objetivando melhor fiscalização em contratos terceirizados da Contratante, nos termos do edital e seus anexos.",CELEPAR-Companhia de Tecnologia da Informação e Comunicação do Paraná,,,2.0,3.0,4.0,3.0,,,0.06438167369181724,1
36,"Contratação de empresa para prestação de serviços continuados de apoio administrativo, com cessão de mão de obra em dedicação exclusiva, para operação e edição de áudio e vídeo para a transmissão das sessões da Primeira e Segunda Câmaras e do Tribunal Pleno, bem como a prestação de serviços de produção audiovisual, design gráfico, videografismos, áudios, vídeos e textos institucionais e educacionais, entre outros temas de interesse do Tribunal de Contas do Estado do Paraná, além do atendimento, sob demanda, dos serviços de maquiador, roteirista, locutor e operador de câmera, incluindo-se a disponibilização de equipamento",TCEPR-Tribunal do Contas do Estado do Paraná,,,1.0,13.0,8.0,16.0,33.0,,-0.14314033221689415,0
38,"Pregão Eletrônico, do Tipo Menor preço por lote, objetivando o Registro de Preços para Futura e eventual contratação de empresa para prestação de serviço SERVENTE, COPEIRO, COZINHEIRO, AUXILIAR DE COZINHA, ENCARREGADA, PORTEIRO E OFICIAL DE MANUTENÇÃO, COLETOR DE RESÍDUOS COM FORNECIMENTO DE MÃO DE OBRA, UNIFORMES, E EQUIPAMENTOS DE PROTEÇÃO INDIVIDUAL para o Hospital Universitário do Oeste do Paraná - HUOP.",UNIOESTE HUOP-Universidade Estadual do Oeste do Paraná - Hospital Universitário do Oeste do Paraná,,,2.0,12.0,13.0,13.0,,,-0.15513490644224442,0
39,"Contratação de empresa especializada na prestação de serviços de manutenção
preventiva e corretiva do sistema de combate a incêndio dos Portos de Paranaguá e Antonina, conforme justificativas, normas e demais especificações estabelecidas no Termo de referência, Edital e anexos.",APPA-Administração dos Portos de Paranaguá e Antonina,,,4.0,3.0,4.0,4.0,,,-0.16068145671540063,0
40,"Contratação de empresa especializada em serviço de transporte de bens, mudança, incluindo o fornecimento de mão de obra para carga e descarga, embalagens, equipamentos e ferramentas, montagem e desmontagem de mobiliário, seguro dos bens durante a carga, transporte e descarga e vistoria dos locais onde serão efetuados os serviços.",JUCEPAR-Junta Comercial do Paraná,,,4.0,6.0,4.0,6.0,,,-0.11398945473721889,0
41,"Contratação de empresa especializada para prestação de serviço de manutenção preventiva, corretiva e conservação de equipamentos de ar-condicionado para atender a demanda da Unioeste - Campus Vila Nova e Campus Água Branca.",UNIOESTE FBELT-Universidade Estadual do Oeste do Paraná - Campus Francisco Beltrão,,,8.0,18.0,170.0,19.0,,,-0.01768541200040219,0
56,"Contratacao de empresa especializada para prestacao do Servico de revitalizacao e 
manutencao do Sistema de Protecao contra Descargas Atmosfericas SPDA dos 
Edifícios Sede e Anexo do TCE-PR.",TCEPR-Tribunal do Contas do Estado do Paraná,,,1.0,2.0,3.0,3.0,1.0,,-0.17677542054720918,0
59,"CONTRATAÇÃO DE EMPRESA DE ENGENHARIA PARA REFORMA
Da cobertura do Ginásio de Esportes José Coaracy Bueno Ferraz - CEFE - UEL",UEL-Universidade Estadual de Londrina,,,1.0,2.0,4.0,4.0,1.0,,-0.14447861843440313,0
88,"Contratação de pessoa jurídica para fornecimento de Películas para identidade civil em acetato fundido 147 mm x 51 mm, conforme Decreto Federal nº 10.977/2022.",CELEPAR-Companhia de Tecnologia da Informação e Comunicação do Paraná,,,4.0,5.0,14.0,5.0,,,-0.1423865436316371,0
91,"A presente licitação tem por objeto a Contratação de Empresa especializada na prestação
continuada de serviços de manutenção da central telefônica da empresa, marca PHILIPS - Tipo
PABX, SOPHO IS3000, Modelo 3030 / 3050",IAT-Instituto Água e Terra (Antigo IAP),,,3.0,4.0,13.0,4.0,10.0,,-0.09710232369885313,0
109,"Contratacao de empresa especializada para execucao dos serviços de engenharia para atualizacao, revisao e ampliação dos projetos da 2 etapa das obras de Recuperação da Orla de Matinhos, bem como a composiçao de custos para a execução da obra, envolvendo a execucao das estruturas marítimas, a macrodrenagem e o engordamento da faixa de praia por meio de aterro hidraulico, conforme planilha orçamentaria de referencia constante no Item 1.2 do Anexo XII.",IAT-Instituto Água e Terra (Antigo IAP),2.0,2.0,6.0,5.0,5.0,6.0,12.0,,-0.14253612375407215,0
111,"Aquisição de Materiais e Equipamentos de apoio à Coordenadoria de Gestão de Materiais para a nova edificação do Almoxarifado da Administração dos Portos do Paraná  conforme justificativas, quantidades e demais especificações  estabelecidas no termo de referência, edital e anexos.",APPA-Administração dos Portos de Paranaguá e Antonina,,,4.0,6.0,10.0,6.0,,,-0.16094154772420627,0
117,"Registro de Preços para fornecimento de Pontos de Acesso Wi-Fi, controladoras de gerenciamento de Wi-fi,  Virtual Data Plane e Filtro de URL com manutenção e suporte técnico.",CELEPAR-Companhia de Tecnologia da Informação e Comunicação do Paraná,,,2.0,4.0,121.0,6.0,9.0,,-0.07822260194081693,0
154,Fornecimento de materiais de uso na manutenção elétrica da UEL.,UEL-Universidade Estadual de Londrina,,,8.0,34.0,34.0,34.0,,,-0.0825679515488637,0
167,"Contratação de empresa especializada para execução dos serviços de engenharia para reforma do terceiro andar da unidade do IDR Paraná localizada na Rua da Bandeira, 500 - Curitiba - Paraná, conforme planilha orçamentaria de referencia constante  no Anexo XIII.",IDR-Instituto de Desenvolvimento Rural do Paraná - IAPAR-EMATER,,,2.0,14.0,17.0,18.0,,,-0.1353976344781725,0
176,Aquisição de materiais elétricos,IDR-Instituto de Desenvolvimento Rural do Paraná - IAPAR-EMATER,,,2.0,3.0,24.0,24.0,,,-0.12525874650613994,0
6,"Contratação de empresa para prestação de Serviços de Engenharia de Reparos no Posto de Polícia Rodoviária de Siqueira Campos, localizado na PR - 092, KM 279 no município de Siqueira Campos- PR.",DER-Departamento de Estradas de Rodagem do Estado do Paraná,,,2.0,7.0,26.0,13.0,16.0,,-0.036173917027274294,0
10,"Contratação de empresa para prestação de Serviços de Engenharia de Reparos na Superintendência Regional Oeste do DER de Cascavel, localizado na PR-486, KM 01, S/N, no município de Cascavel/PR.",DER-Departamento de Estradas de Rodagem do Estado do Paraná,,,2.0,26.0,42.0,27.0,2.0,,-0.12520974099951548,0
15,Material Elétrico e Lâmpadas,DECON-Departamento de Logística para Contratações Públicas (Antigo DEAM),44.0,11.0,2.0,35.0,43.0,46.0,813.0,,-0.07492086842157247,0
15,Material Elétrico e Lâmpadas,DECON-Departamento de Logística para Contratações Públicas (Antigo DEAM),44.0,11.0,2.0,35.0,43.0,46.0,813.0,,-0.07492086842157247,0
23,"Contratação de empresa para a prestação de serviços comuns de engenharia referentes a Reparos na Superintendência Regional Noroeste do DER/PR, com área total aproximada de 1.131,60 m2.",DER-Departamento de Estradas de Rodagem do Estado do Paraná,,,3.0,5.0,7.0,6.0,,,-0.16062921190148083,0
35,"Contratação de empresa especializada para a prestação de serviços contínuos de manutenção preventiva e corretiva mensal dos aparelhos de ar-condicionado, incluindo, sob demanda, o fornecimento de materiais e serviços de instalações e desinstalações para atender as unidades do Departamento de Estradas de Rodagem do Paraná, pelo período de doze meses, conforme especificações contidas no Anexo I Termo de Referência.",DER-Departamento de Estradas de Rodagem do Estado do Paraná,,,17.0,1.0,16.0,16.0,,,-0.09566449498583862,0
47,"Formação de registro de preços para aquisição de materiais elétricos, hidráulicos, de
sinalização, ferragens e materiais correlatos destinados à manutenção predial, visando a
conservação do patrimônio público, com vistas ao atendimento das demandas da
Assembleia Legislativa do Estado do Paraná, para permitir a manutenção das condições
adequadas e indispensáveis para a realização das atividades que compõem a missão
institucional deste Poder Legislativo.",ALEP-Assembleia Legislativa do Estado do Paraná,,,4.0,35.0,139.0,18.0,137.0,,-0.05480652086640603,0
75,"Contratação de empresa especializada para a prestação de Serviço de Manutenção Preventiva e Corretiva de Extintores de PQS, CO2, AP, ABC e Mangueiras de Incêndio com substituição de componentes, quando estimado no lote, para atender o Edifício Sede e demais unidades do Departamento de Estradas de Rodagem DER/PR",DER-Departamento de Estradas de Rodagem do Estado do Paraná,,,8.0,8.0,8.0,8.0,,,-0.10133436238594457,0
91,"Contratação de empresa para assessoria e serviços nas áreas de Engenharia Civil e Engenharia Elétrica para os imóveis de propriedade da PARANAPREVIDÊNCIA, atendendo as demandas da Instituição, respeitadas as especificações técnicas e quantidades descritas neste Edital.",PRPREV-Serviço Social Autônomo PARANAPREVIDENCIA,,,3.0,4.0,13.0,4.0,10.0,,-0.09710232369885313,0
96,"Contratação de empresa para o fornecimento de bens e serviços de Tecnologia da Informação e Comunicação TIC, sendo uma Solução de Switches e Infraestrutura em Fibra Óptica, incluindo manutenção e suporte técnico e demais condições aqui estabelecidas, para o Departamento de Estradas de Rodagem do Paraná.",DER-Departamento de Estradas de Rodagem do Estado do Paraná,,,4.0,9.0,81.0,8.0,,,-0.10906188594969668,0
98,"Prestação de serviços contínuos, sem regime de dedicação exclusiva de mão de obra, de manutenção preventiva mensal e corretiva conforme demanda, em aparelhos de ar-condicionado instalados, com fornecimento de peças à parte, para atender a necessidade da Secretaria de Estado da Administração e da Previdência e do Departamento de Arquivo Público.",DECON-Departamento de Logística para Contratações Públicas (Antigo DEAM),,,3.0,3.0,5.0,3.0,,,-0.15463276201191833,0
100,"Contratação de empresa especializada para execução de serviços comuns de engenharia no
Colégio Estadual La Salle, localizado na Rua Dilermando Pereira de Almeida, 120, Pinheirinho,
telefone 41 3349-7160/3349-8653, no Município de Curitiba, Estado do Paraná",FUNDEPAR-Instituto Paranaense de Desenvolvimento Educacional,,,2.0,2.0,2.0,2.0,,,-0.17160395909420534,0
117,"A presente licitação tem por objeto a aquisição de materiais de consumo como materiais elétricos, e de laboratório para atender às necessidades do Campus de Paranaguá da UNESPAR, conforme especificações constantes no edital e em seus anexos.",UNESPAR-Universidade Estadual do Paraná,,,2.0,4.0,121.0,6.0,9.0,,-0.07822260194081693,0
122,"Prestação de serviços continuados de Manutenção preventiva e corretiva para o Sistema de Alarme e Detecção de Incêndio, sem fornecimento de peças de reposição para atender a demanda do Departamento Estadual de Arquivo Público",DECON-Departamento de Logística para Contratações Públicas (Antigo DEAM),,,3.0,3.0,3.0,3.0,,,-0.17444084634191054,0
159,"Contratação de empresa para prestação de Serviço de confecção e instalação de Persianas Modelo Rollô, com fornecimento de todo o material e mão de obra necessário à confecção e instalação, para atender à demanda da 8ª Regional de Saúde  Francisco Beltrão Pr",SESA-FUNSAUDE-Fundo Estadual de Saúde do Paraná - FUNSAUDE,,,2.0,3.0,2.0,3.0,,,-0.17331005663311205,0
169,"Contratação de empresa especializada para execução de serviços comuns de engenharia no Colégio Estadual Padre Cláudio Morelli, localizado na Rua Luiz Nichele, 08, Bairro Umbará, telefone 41 3348-4532 e  3348-2115, no Município de Curitiba, Estado do Paraná",FUNDEPAR-Instituto Paranaense de Desenvolvimento Educacional,,,2.0,2.0,2.0,2.0,,,-0.1744589081264371,0
184,"Contratação de empresa especializada para execução de serviços comuns de engenharia no Colégio Estadual Professora Reni Correia Gamper, localizado na Rua Primeiro de Maio, 454, Centro, telefone 43 3435-1332, no Município de Manoel Ribas, Estado do Paraná",FUNDEPAR-Instituto Paranaense de Desenvolvimento Educacional,,,1.0,1.0,1.0,1.0,,,-0.16957088109314422,0
195,"Fornecimento, instalação, montagem, configuração, manutenção preventiva e manutenção corretiva assistência técnica de uma plataforma de colaboração IP em nuvem privada, com recursos de ramais, URA, gravação de ligações, licenças para 30 usuários e sobrevivência do ambiente para a Universidade Estadual do Paraná  UNESPAR, Campus de Paranaguá",UNESPAR-Universidade Estadual do Paraná,,,2.0,2.0,3.0,2.0,,,-0.17035783626740847,0
202,"Contratação de empresa especializada para execução de serviços comuns de engenharia no Colégio Estadual do Campo Professora Maria de Jesus Pacheco Guimarães, localizado na Rua Anadir Paulina Tonon, 01, Distrito de Guará, telefone 42 3649-1164, no Município de Guarapuava, Estado do Paraná.",FUNDEPAR-Instituto Paranaense de Desenvolvimento Educacional,,,1.0,2.0,2.0,2.0,,,-0.17368366608574115,0
